{
  "hypothetical": true,
  "note": "합성 관찰 — 포트 계약·관문·사법부 판정 시험용. 실측값이 아니다 (데이터베이스에 넣으면 관문이 거부).",
  "observable": { "kind": "amount", "target": "D000030|plasma_membrane" },
  "value": 1200,
  "unit": "molecule",
  "uncertainty": { "kind": "measurement", "model": "normal", "sd": 60 },
  "replicates": 3,
  "condition": { "species": "9606", "time_s": 3600 },
  "calibration": { "kind": "linear", "a": 2, "b": 0 },
  "raw": 600,
  "use": "validation",
  "evidence": { "level": "computed", "tool": "synthetic fixture" }
}
